{
  "contract_id": "SF-CON-PAYMENT-INTENT",
  "contract_status": "FROZEN",
  "freeze_status": "FROZEN",
  "tenant_id": "11111111-1111-4111-8111-111111111111",
  "payment_intent_id": "66666666-6666-4666-8666-666666666666",
  "fee_quote_id": "22222222-2222-4222-8222-222222222222",
  "application_id": "33333333-3333-4333-8333-333333333333",
  "currency": "INR",
  "amount_minor": 10000,
  "amount_locked_from_fee_quote": true,
  "client_supplied_amount_forbidden": true,
  "status": "CREATED",
  "connector_binding_id": "77777777-7777-4777-8777-777777777777",
  "connector_mode": "SANDBOX",
  "simulation_marker_required_when_simulated": true,
  "idempotency_key": "pay-intent-demo-001"
}
